[
    {
        "Категория": "PowerShell",
        "Event ID": "4104",
        "Название события": "Логирование блока скрипта PowerShell",
        "Лог": "Microsoft-Windows-PowerShell/Operational",
        "Важность": "Высокая",
        "Описание": "Был выполнен блок кода PowerShell",
        "Подробности": "Содержит фактический выполняемый код/скрипт PowerShell (если скрипт очень длинный, регистрируется несколько событий 4104), а в 4103 записывается отдельная команда или командлет",
        "Индикаторы атаки": "• Obfuscated код (base64, char массивы)\n• Использование -EncodedCommand\n• Вызов опасных скриптов (Mimikatz, PowerSploit)\n• Загрузка payload из интернета (DownloadString)\n• AMSI bypass техники",
        "Типичные сценарии": null,
        "Ключевые поля": null,
        "Документация для данного EventCode": "https://learn.microsoft.com/en-us/powershell/module/microsoft.powershell.core/about/about_logging_windows?view=powershell-7.4#script-block-logging",
        "SPL-шаблон": "index=wineventlog source=\"WinEventLog:Microsoft-Windows-PowerShell/Operational\" EventCode=4104\n| eval susp=if(match(ScriptBlockText,\"(?i)(invoke-mimikatz|frombase64|downloadstring|iex |amsi|reflection.assembly)\"),1,0)\n| where susp=1",
        "Корреляции": "4103 (PowerShell pipeline)\n4688 (запуск powershell.exe)\n4624 LogonType=3 (сетевой вызов PS)\n400/600 (PowerShell engine в Windows PowerShell log)"
    },
    {
        "Категория": "PowerShell",
        "Event ID": "4103",
        "Название события": "Выполнение скрипта PowerShell",
        "Лог": "Microsoft-Windows-PowerShell/Operational",
        "Важность": "Высокая",
        "Описание": "Был выполнен скрипт PowerShell",
        "Подробности": "событие журнала регистрирует детальное выполнение каждой отдельной команды или командлета по мере их обработки ядром PowerShell.",
        "Индикаторы атаки": "• Скрипты с obfuscation\n• Использование -EncodedCommand\n• Запуск из временных папок\n• Скрипты, загружающие payload\n• Использование AMSI bypass техник",
        "Типичные сценарии": null,
        "Ключевые поля": null,
        "Документация для данного EventCode": "https://learn.microsoft.com/en-us/powershell/module/microsoft.powershell.core/about/about_logging_windows#module-logging",
        "SPL-шаблон": "index=wineventlog source=\"*PowerShell/Operational\" EventCode=4103\n  HostApplication=\"*-enc*\" OR Payload=\"*Invoke-*\"\n| table _time, host, User, HostApplication, Payload",
        "Корреляции": "4104 (script block, основное)\n4105/4106 (начало/окончание скрипта)\n400/600 (Windows PowerShell log)"
    },
    {
        "Категория": "Разведка (Discovery)",
        "Event ID": "4798",
        "Название события": "Перечисление пользователей в группе",
        "Лог": "Security",
        "Важность": "Средняя",
        "Описание": "Запрос состава группы (net group, Get-ADGroupMember)",
        "Подробности": "Содержит информацию о группе, субъекте запроса и клиентском IP",
        "Индикаторы атаки": "• Разведка привилегированных групп (Domain Admins, Enterprise Admins)\n• Перечисление групп из неожиданных IP\n• Массовые запросы о составе групп\n• Запросы в нерабочее время",
        "Типичные сценарии": "• Администратор проверяет состав группы\n• Скрипт аудита перечисляет членство\n• Приложение запрашивает информацию о группе",
        "Ключевые поля": "• Group Name - имя группы\n• Subject User - пользователь, выполнивший запрос\n• Client Address - IP адрес клиента",
        "Документация для данного EventCode": "https://learn.microsoft.com/en-us/windows/security/threat-protection/auditing/event-4798",
        "SPL-шаблон": "index=wineventlog EventCode=4798\n  NOT Caller_Process_Name=\"*\\\\lsass.exe\" NOT Caller_Process_Name=\"*\\\\svchost.exe\"\n| stats count values(Caller_Process_Name) AS callers by Subject_User_Name, Target_User_Name\n| where count>20",
        "Корреляции": "4799 (перечисление групп)\n4688 (net.exe, whoami /groups, AdFind)"
    },
    {
        "Категория": "Разведка (Discovery)",
        "Event ID": "4799",
        "Название события": "Перечисление групп в AD",
        "Лог": "Security",
        "Важность": "Средняя",
        "Описание": "Запрос групп в домене (net localgroup, Get-ADGroup)",
        "Подробности": "Содержит информацию о субъекте запроса и клиентском IP   Windows регистрирует это событие, когда процесс выполняет перечисление членов указанной локальной группы на этом компьютере.",
        "Индикаторы атаки": "• Разведка структуры Active Directory\n• Перечисление групп из неожиданных IP\n• Массовые запросы о группах\n• Запросы в нерабочее время",
        "Типичные сценарии": "• Администратор перечисляет группы\n• Скрипт аудита собирает информацию о группах\n• Приложение запрашивает список групп",
        "Ключевые поля": "• Subject User - пользователь, выполнивший запрос\n• Client Address - IP адрес клиента",
        "Документация для данного EventCode": "https://learn.microsoft.com/en-us/windows/security/threat-protection/auditing/event-4799",
        "SPL-шаблон": "index=wineventlog EventCode=4799\n  Group_Name IN (\"Administrators\",\"Domain Admins\",\"Enterprise Admins\")\n  NOT Caller_Process_Name=\"*\\\\lsass.exe\"\n| table _time, host, Caller_Process_Name, Subject_User_Name, Group_Name",
        "Корреляции": "4798 (перечисление групп пользователя)\n4688 (net localgroup, BloodHound)"
    },
    {
        "Категория": "Разведка (Discovery)",
        "Event ID": "5136",
        "Название события": "Изменение объекта каталога",
        "Лог": "Security",
        "Важность": "Средняя",
        "Описание": "Изменение любого объекта в Active Directory",
        "Подробности": "Содержит информацию об операции, объекте, атрибутах и субъекте  Это событие будет зарегистрировано только в том случае, если в политике аудита объекта включено аудирование для соответствующих свойств или действий, и это касается пользователя, выполнившего действие, или группы, к которой пользователь принадлежит.",
        "Индикаторы атаки": "• DCSync атаки (репликация изменений)\n• Изменение членства в привилегированных группах\n• Модификация атрибутов безопасности\n• Добавление SID History",
        "Типичные сценарии": "• Изменение объектов AD администратором\n• Синхронизация между DC\n• Модификация атрибутов объектов",
        "Ключевые поля": "• Object DN - Distinguished Name объекта\n• Operation Type - тип операции (Value Added, Value Deleted)\n• Attribute LDAP Display Name - атрибут AD\n• Subject - кто выполнил операцию",
        "Документация для данного EventCode": "https://learn.microsoft.com/en-us/windows/security/threat-protection/auditing/event-5136",
        "SPL-шаблон": "index=wineventlog EventCode=5136\n  LDAP_Display_Name IN (\"servicePrincipalName\",\"msDS-AllowedToActOnBehalfOfOtherIdentity\",\"msDS-AllowedToDelegateTo\")\n| table _time, host, Subject_User_Name, Object_DN, LDAP_Display_Name, Value, Operation",
        "Корреляции": "5137 (создание объекта)\n4742 (изменение компьютера)\nKerberos delegation abuse = 4768/4769 + 5136"
    },
    {
        "Категория": "Разведка (Discovery)",
        "Event ID": "5137",
        "Название события": "Создание объекта каталога",
        "Лог": "Security",
        "Важность": "Средняя",
        "Описание": "Создание объекта в Active Directory",
        "Подробности": "Содержит информацию об объекте, его DN и субъекте создания",
        "Индикаторы атаки": "• Создание backdoor учетных записей\n• Создание нелегитимных объектов\n• Создание объектов в нерабочее время\n• Массовое создание объектов",
        "Типичные сценарии": "• Создание пользователя администратором\n• Добавление новой группы\n• Создание объекта службы",
        "Ключевые поля": "• DS Name - имя каталога\n• Object DN - Distinguished Name объекта\n• Subject - субъект создания",
        "Документация для данного EventCode": "https://learn.microsoft.com/en-us/windows/security/threat-protection/auditing/event-5137",
        "SPL-шаблон": "index=wineventlog EventCode=5137\n| table _time, host, Subject_User_Name, Object_DN, Object_Class",
        "Корреляции": "5136 (изменение)\n5138 (undelete)\n5139 (перемещение)"
    },
    {
        "Категория": "Разведка (Discovery)",
        "Event ID": "5138",
        "Название события": "Объект службы каталогов восстановлен",
        "Лог": "Security",
        "Важность": "Средняя",
        "Описание": "Восстановление объекта из Active Directory",
        "Подробности": "Содержит информацию об удаленном восстановленном объекте и субъекте",
        "Индикаторы атаки": "• Восстановление ранее удалённых административных или служебных учётных записей\n• Повторное появление объектов с изменёнными атрибутами доступа\n• Восстановление объектов в нерабочее время неавторизованными пользователями\n• Массовое восстановление объектов после массового удаления (возможная подготовка к восстановлению после атаки)\n• Восстановление отключённых или скомпрометированных объектов без изменения пароля/состояния",
        "Типичные сценарии": "• Плановое восстановление ошибочно удалённых учётных записей пользователей\n• Восстановление объектов из корзины Active Directory после тестирования\n• Возврат организационных подразделений (OU) после реорганизации структуры каталога\n• Восстановление групп доступа при устранении последствий сбоя миграции\n• Легальное восстановление объектов в рамках процедур аварийного восстановления (DR)",
        "Ключевые поля": null,
        "Документация для данного EventCode": "https://learn.microsoft.com/en-us/windows/security/threat-protection/auditing/event-5138",
        "SPL-шаблон": "index=wineventlog EventCode=5138\n| table _time, host, Subject_User_Name, Object_DN",
        "Корреляции": "5136 (восстановление изменяет атрибуты)\n5141 (удаление после undelete)"
    }
]