[
    {
        "Категория": "RDP (RemoteConnectionManager)",
        "Event ID": "1149",
        "Название события": "Remote Desktop Services: User authentication succeeded",
        "Лог": "Microsoft-Windows-TerminalServices-RemoteConnectionManager/Operational",
        "Важность": "Критическая",
        "Описание": "Успешная аутентификация пользователя через RDP. Это ключевое событие начала сессии.",
        "Подробности": "Содержит данные об аутентификации: пользователь, домен, IP-адрес источника, протокол.",
        "Индикаторы атаки": "• Несанкционированный доступ\n• Lateral movement\n• Атаки с использованием скомпрометированных учетных данных\n• Входы из неожиданных географических локаций",
        "Типичные сценарии": "• Легитимный удаленный доступ администратора\n• Подключение пользователя к рабочему столу VDI/RDS",
        "Ключевые поля": "• User\n• Domain\n• SourceNetworkAddress\n• Protocol",
        "Документация для данного EventCode": "https://www.ultimatewindowssecurity.com/securitylog/encyclopedia/event.aspx?eventID=1149",
        "SPL-шаблон": "index=wineventlog source=\"*TerminalServices-RemoteConnectionManager*\" EventCode=1149\n| stats count values(Param3) AS src_ip by Param1, host",
        "Корреляции": "4624 LogonType=10 (интерактивный RDP)\n4778 (RDP session reconnect)\n21/22/25 (LocalSessionManager events)"
    },
    {
        "Категория": "RDP (RemoteConnectionManager)",
        "Event ID": "261",
        "Название события": "Прослушиватель RDP-Tcp получил соединение",
        "Лог": "Microsoft-Windows-TerminalServices-RemoteConnectionManager/Operational",
        "Важность": "Высокая",
        "Описание": "Установка сетевого подключения к прослушивателю RDP. Не означает успешный логин.",
        "Подробности": "Факт установки TCP-соединения (SYN, ACK).",
        "Индикаторы атаки": "• Сканирование портов 3389\n• Попытки перебора (брутфорс) учетных данных RDP\n• Проверка доступности службы RDP перед атакой",
        "Типичные сценарии": "• Нормальная попытка подключения пользователя\n• Автоматизированные проверки доступности сервиса",
        "Ключевые поля": "• SourceNetworkAddress\n• ListenerName",
        "Документация для данного EventCode": "https://learn.microsoft.com/en-us/troubleshoot/windows-server/remote/troubleshoot-remote-desktop-connections",
        "SPL-шаблон": "index=wineventlog source=\"*TerminalServices-RemoteConnectionManager*\" EventCode=261\n| stats count by Source_Network_Address\n| where count>20",
        "Корреляции": "1149 (успешная аутентификация)\n4624 LogonType=10\n140 (RDP Client side)"
    },
    {
        "Категория": "RDP (RemoteConnectionManager)",
        "Event ID": "258",
        "Название события": "Прослушиватель RDP-Tcp начал прослушивание",
        "Лог": "Microsoft-Windows-TerminalServices-RemoteConnectionManager/Operational",
        "Важность": "Средняя",
        "Описание": "Служба RDP (Terminal Services) запустила прослушиватель на порту.",
        "Подробности": "Служба начала ожидать входящих подключений.",
        "Индикаторы атаки": "• Несанкционированный запуск службы RDP на системе, где она должна быть отключена\n• Перезапуск службы злоумышленником после сбоя",
        "Типичные сценарии": "• Штатный запуск на RDS-сервере\n• Администратор вручную включает службу для удаленного доступа",
        "Ключевые поля": "• ListenerName\n• PortNumber",
        "Документация для данного EventCode": "https://learn.microsoft.com/en-us/troubleshoot/windows-server/remote/troubleshoot-remote-desktop-connections",
        "SPL-шаблон": "index=wineventlog source=\"*TerminalServices-RemoteConnectionManager*\" EventCode=258",
        "Корреляции": "1149 (аутентификация)\n261 (listener started)"
    },
    {
        "Категория": "RDP (RemoteConnectionManager)",
        "Event ID": "263",
        "Название события": "Графический режим WDDM включен",
        "Лог": "Microsoft-Windows-TerminalServices-RemoteConnectionManager/Operational",
        "Важность": "Низкая",
        "Описание": "Переключение сессии на использование драйвера дисплея WDDM.",
        "Подробности": "Техническая деталь о графическом стеке для улучшения производительности.",
        "Индикаторы атаки": "Крайне низка. Теоретически, нестандартный драйвер может использоваться для уязвимостей, но это маловероятно.",
        "Типичные сценарии": "• Подключение с клиента Windows с современной графикой\n• Автоматический выбор графического стека",
        "Ключевые поля": "• SessionID",
        "Документация для данного EventCode": "https://learn.microsoft.com/en-us/troubleshoot/windows-server/remote/troubleshoot-remote-desktop-connections",
        "SPL-шаблон": "index=wineventlog source=\"*TerminalServices-RemoteConnectionManager*\" EventCode=263",
        "Корреляции": "Служебное событие RDP — без прямых корреляций для SOC"
    },
    {
        "Категория": "RDP (RemoteConnectionManager)",
        "Event ID": "1155",
        "Название события": "Диспетчер удаленных подключений выбрал стек протоколов RDP режима ядра",
        "Лог": "Microsoft-Windows-TerminalServices-RemoteConnectionManager/Operational",
        "Важность": "Низкая",
        "Описание": "Выбор сетевого стека для обработки RDP-трафика.",
        "Подробности": "Указывает на использование высокопроизводительного стека \"kernel-mode\".",
        "Индикаторы атаки": "Маловероятен.",
        "Типичные сценарии": "• Инициализация соединения на серверах с высокой нагрузкой",
        "Ключевые поля": "• SessionID\n• StackName",
        "Документация для данного EventCode": "https://learn.microsoft.com/en-us/windows-server/remote/remote-desktop-services/welcome-to-rds",
        "SPL-шаблон": "index=wineventlog source=\"*TerminalServices-LocalSessionManager*\" EventCode=1155",
        "Корреляции": "Служебное событие (оптимизация GPU) — без корреляций"
    },
    {
        "Категория": "RDP (RemoteConnectionManager)",
        "Event ID": "20523",
        "Название события": "Для подключения от прослушивателя RDP-Tcp будет задан класс терминала {5828227c-20cf-4408-b73f-73ab70b8849f}",
        "Лог": "Microsoft-Windows-TerminalServices-RemoteConnectionManager/Operational",
        "Важность": "Низкая",
        "Описание": "Назначение класса терминала для нового подключения.",
        "Подробности": "Внутренний идентификатор для управления сессией.",
        "Индикаторы атаки": "Маловероятен.",
        "Типичные сценарии": "• Создание новой сессии удаленного рабочего стола",
        "Ключевые поля": "• SessionID\n• TerminalClass",
        "Документация для данного EventCode": "https://learn.microsoft.com/en-us/windows-server/remote/remote-desktop-services/welcome-to-rds",
        "SPL-шаблон": "index=wineventlog source=\"*RemoteDesktopServices*\" EventCode=20523",
        "Корреляции": "Информационное событие RDS — без SOC-корреляций"
    },
    {
        "Категория": "RDP (RemoteConnectionManager)",
        "Event ID": "1143",
        "Название события": "Параметр 'Limit the size of the entire roaming user profile cache' групповой политики был выключен",
        "Лог": "Microsoft-Windows-TerminalServices-RemoteConnectionManager/Operational",
        "Важность": "Средняя",
        "Описание": "Изменение параметра политики, ограничивающего кэш профилей пользователей.",
        "Подробности": "Указывает на отключение ограничения размера профиля.",
        "Индикаторы атаки": "• Подготовка окружения для атаки, требующей записи большого объема данных в профиль\n• Сокрытие инструментов в кэше профиля",
        "Типичные сценарии": "• Административная настройка сервера для увеличения лимита профилей",
        "Ключевые поля": "• PolicyName\n• NewValue",
        "Документация для данного EventCode": "https://learn.microsoft.com/en-us/windows-server/remote/remote-desktop-services/rds-remotefx-vgpu",
        "SPL-шаблон": "index=wineventlog source=\"*RemoteDesktopServices-RemoteFX*\" EventCode=1143",
        "Корреляции": "Информационное событие RemoteFX"
    },
    {
        "Категория": "RDP (RemoteConnectionManager)",
        "Event ID": "1136",
        "Название события": "Не установлена роль сервера узлов сеансов удаленных рабочих столов",
        "Лог": "Microsoft-Windows-TerminalServices-RemoteConnectionManager/Operational",
        "Важность": "Информационное",
        "Описание": "Попытка использовать функциональность RDS на системе без установленной соответствующей роли.",
        "Подробности": "Ошибка конфигурации: служба пытается выполнить действие, для которого не установлена полная роль RDS.",
        "Индикаторы атаки": "Маловероятен, это скорее ошибка конфигурации.",
        "Типичные сценарии": "• Попытка запуска RDS-функции на обычном сервере или рабочей станции",
        "Ключевые поля": "• ErrorCode\n• MissingComponent",
        "Документация для данного EventCode": "https://learn.microsoft.com/en-us/windows-server/remote/remote-desktop-services/welcome-to-rds",
        "SPL-шаблон": "index=wineventlog source=\"*RemoteDesktopServices-RdpCoreTS*\" EventCode=1136",
        "Корреляции": "Ошибка конфигурации RDS — диагностика, не SOC"
    }
]